<?xml version="1.0" encoding="UTF-8"?>
<!DOCTYPE employees SYSTEM "employees.dtd">
<?xml-stylesheet type="text/xsl" href="employees.xsl"?>
<?xml-stylesheet type="text/css" href="employees.css"?>
<employees xmlns:xsi="http://www.w3.org/2001/XMLSchema-instance"
           xsi:noNamespaceSchemaLocation="employees.xsd">
    <employee id="E1001">
        <name>John Smith</name>
        <position>Software Developer</position>
        <department>IT</department>
        <salary>75000</salary>
        <hire_date>2018-06-15</hire_date>
    </employee>
    <employee id="E1002">
        <name>Sarah Johnson</name>
        <position>HR Manager</position>
        <department>Human Resources</department>
        <salary>68000</salary>
        <hire_date>2019-03-22</hire_date>
    </employee>
    <employee id="E1003">
        <name>Michael Brown</name>
        <position>Sales Executive</position>
        <department>Marketing</department>
        <salary>62000</salary>
        <hire_date>2020-11-05</hire_date>
    </employee>
</employees>